{
  "id": "0d7e8b10-4eaf-49de-8c27-0b6e0ae7b001",
  "vessel_cid": "bafybeifoundationphasebasefixture001",
  "owner": "evm:0x1111111111111111111111111111111111111111",
  "payout_target": "evm:0x2222222222222222222222222222222222222222",
  "royalty_split": [
    {
      "recipient": "evm:0x2222222222222222222222222222222222222222",
      "basis_points": 7000
    },
    {
      "recipient": "evm:0x3333333333333333333333333333333333333333",
      "basis_points": 3000
    }
  ],
  "badges": [
    "signature_verified",
    "lineage_verified"
  ],
  "state": "listed",
  "created_at": "2026-05-28T00:00:00Z",
  "updated_at": "2026-05-28T00:30:00Z",
  "lineage_ref": "lineage:bafybeiorbelbasefixture001"
}
