{
  "id": "1a9c0d25-96a0-4bbf-97d8-9a7bfafbc002",
  "vessel_cid": "bafybeifoundationphasesolanafixture002",
  "owner": "solana:11111111111111111111111111111111",
  "payout_target": "solana:So11111111111111111111111111111111111111112",
  "royalty_split": [
    {
      "recipient": "solana:So11111111111111111111111111111111111111112",
      "basis_points": 8000
    },
    {
      "recipient": "solana:Vote111111111111111111111111111111111111111",
      "basis_points": 2000
    }
  ],
  "badges": [
    "curator_reviewed",
    "rights_holder_verified"
  ],
  "state": "listed",
  "created_at": "2026-05-28T01:00:00Z",
  "updated_at": "2026-05-28T01:15:00Z",
  "lineage_ref": "lineage:bafybeiorbelsolanafixture002"
}
